{
  "tool_version": "pta-0.1.0",
  "schema_version": "1.0",
  "mode": "github",
  "generated_at": "2026-02-15T10:35:41.171253+00:00",
  "boot": {
    "install": [
      {
        "status": "UNKNOWN",
        "action": "Install dependencies",
        "command": "",
        "evidence": [],
        "unknown_reason": "No lockfile or package manifest detected"
      }
    ],
    "dev": [
      {
        "status": "UNKNOWN",
        "action": "Start dev server",
        "command": "",
        "evidence": [],
        "unknown_reason": "No dev script or run command detected"
      }
    ],
    "prod": [
      {
        "status": "UNKNOWN",
        "action": "Start production",
        "command": "",
        "evidence": [],
        "unknown_reason": "No build/start script detected"
      }
    ],
    "ports": [
      {
        "status": "UNKNOWN",
        "value": "",
        "evidence": [],
        "unknown_reason": "No port binding detected in source files"
      }
    ]
  },
  "integrate": {
    "base_path": {
      "status": "UNKNOWN",
      "value": "",
      "evidence": [],
      "unknown_reason": "No API endpoints detected"
    },
    "endpoints": [],
    "auth": [
      {
        "status": "UNKNOWN",
        "value": "",
        "evidence": [],
        "unknown_reason": "No explicit auth middleware or bearer token parsing detected"
      }
    ],
    "env_vars": []
  },
  "deploy": {
    "docker": {
      "status": "UNKNOWN",
      "dockerfile": false,
      "compose": false,
      "evidence": [],
      "unknown_reason": "No Dockerfile detected"
    },
    "platform_hints": [],
    "build_commands": []
  },
  "snapshot": {
    "runtime": [
      {
        "status": "UNKNOWN",
        "value": "",
        "evidence": [],
        "unknown_reason": "No runtime package manifest detected"
      }
    ],
    "entrypoints": [
      {
        "status": "UNKNOWN",
        "value": "",
        "evidence": [],
        "unknown_reason": "No common entrypoint file detected"
      }
    ],
    "datastore": [
      {
        "status": "UNKNOWN",
        "value": "",
        "evidence": [],
        "unknown_reason": "No datastore dependency detected"
      }
    ],
    "migrations": [
      {
        "status": "UNKNOWN",
        "value": "",
        "evidence": [],
        "unknown_reason": "No migration/schema tool detected"
      }
    ],
    "observability": [
      {
        "status": "UNKNOWN",
        "value": "",
        "evidence": [],
        "unknown_reason": "No health endpoint or observability setup detected"
      }
    ]
  },
  "readiness": {
    "boot": {
      "score": 0,
      "reasons": [
        "3 boot item(s) unknown",
        "Blocker: No lockfile or package manifest detected"
      ]
    },
    "integration": {
      "score": 0,
      "reasons": [
        "1 integration item(s) unknown",
        "Blocker: No explicit auth middleware or bearer token parsing detected"
      ]
    },
    "deployment": {
      "score": 0,
      "reasons": [
        "1 deployment item(s) unknown",
        "Blocker: No Dockerfile detected"
      ]
    },
    "observability": {
      "score": 0,
      "reasons": [
        "1 observability item(s) unknown",
        "Blocker: No health endpoint or observability setup detected"
      ]
    }
  },
  "gaps": [
    {
      "rank": 1,
      "title": "No lockfile or package manifest detected",
      "severity": "high",
      "status": "UNKNOWN",
      "evidence": [],
      "action": "Investigate and document Install"
    },
    {
      "rank": 2,
      "title": "No dev script or run command detected",
      "severity": "high",
      "status": "UNKNOWN",
      "evidence": [],
      "action": "Investigate and document Dev run"
    },
    {
      "rank": 3,
      "title": "No build/start script detected",
      "severity": "high",
      "status": "UNKNOWN",
      "evidence": [],
      "action": "Investigate and document Prod run"
    },
    {
      "rank": 4,
      "title": "No port binding detected in source files",
      "severity": "medium",
      "status": "UNKNOWN",
      "evidence": [],
      "action": "Investigate and document Port binding"
    },
    {
      "rank": 5,
      "title": "No Dockerfile detected",
      "severity": "medium",
      "status": "UNKNOWN",
      "evidence": [],
      "action": "Add Dockerfile or document deploy method"
    },
    {
      "rank": 6,
      "title": "No deployment platform hints detected",
      "severity": "medium",
      "status": "UNKNOWN",
      "evidence": [],
      "action": "Add platform config (Procfile, vercel.json, etc.)"
    },
    {
      "rank": 7,
      "title": "No explicit auth middleware or bearer token parsing detected",
      "severity": "medium",
      "status": "UNKNOWN",
      "evidence": [],
      "action": "Investigate and document Authentication"
    },
    {
      "rank": 8,
      "title": "No health endpoint or observability setup detected",
      "severity": "low",
      "status": "UNKNOWN",
      "evidence": [],
      "action": "Investigate and document Observability"
    },
    {
      "rank": 9,
      "title": "No migration/schema tool detected",
      "severity": "low",
      "status": "UNKNOWN",
      "evidence": [],
      "action": "Investigate and document Database migrations"
    }
  ],
  "runbooks": {
    "local_dev": [
      {
        "step": 1,
        "status": "UNKNOWN",
        "action": "Install dependencies",
        "command": "",
        "evidence": [],
        "unknown_reason": "No lockfile or package manifest detected"
      },
      {
        "step": 2,
        "status": "UNKNOWN",
        "action": "Start dev server",
        "command": "",
        "evidence": [],
        "unknown_reason": "No dev script or run command detected"
      }
    ],
    "production": [
      {
        "step": 1,
        "status": "UNKNOWN",
        "action": "Install dependencies",
        "command": "",
        "evidence": [],
        "unknown_reason": "No lockfile or package manifest detected"
      },
      {
        "step": 2,
        "status": "UNKNOWN",
        "action": "Start production",
        "command": "",
        "evidence": [],
        "unknown_reason": "No build/start script detected"
      }
    ],
    "integration": [
      {
        "step": 1,
        "status": "UNKNOWN",
        "action": "Integration steps",
        "command": "",
        "evidence": [],
        "unknown_reason": "No API endpoints detected"
      }
    ],
    "troubleshooting": [
      {
        "step": 1,
        "status": "UNKNOWN",
        "action": "Troubleshooting steps",
        "command": "",
        "evidence": [],
        "unknown_reason": "Insufficient data for troubleshooting guidance"
      }
    ]
  }
}